{
  "version": { "major": 1, "minor": 0 },
  "ids": {
    "session_id": "11111111-1111-1111-1111-111111111111",
    "turn_id": "22222222-2222-2222-2222-222222222222",
    "request_id": "33333333-3333-3333-3333-333333333333"
  },
  "source_id": "audio2face",
  "epoch": 3,
  "sequence": 7,
  "sample_rate": 48000,
  "sample_offset": 4800,
  "blendshapes": { "jawOpen": 0.6, "eyeBlinkLeft": 0.2 },
  "semantics": []
}
